<?xml version="1.0"?>
<person xmlns="https://www.w3schools.com"
      xmlns:xsi="http://www.w3.org/2001/XMLSchema-instance"
      xsi:schemaLocation="https://www.w3schools.com schema.xsd">

    <employee id="1">
        <name>Tony</name>
        <phone>357790</phone>
        <phone>124903</phone>
        <age>23</age>
        <home>
            <country>Russia</country>
            <city>Moscow</city>
            <street>Main-street, 4</street>
        </home>
    </employee>
    <planet>Earth</planet>
</person>